Frame 1: 58 bytes on wire (464 bits), 58 bytes captured (464 bits)
    Encapsulation type: PPP (4)
    Arrival Time: Dec 31, 1969 19:00:01.000000000 EST
    [Time shift for this packet: 0.000000000 seconds]
    Epoch Time: 1.000000000 seconds
    [Time delta from previous captured frame: 0.000000000 seconds]
    [Time delta from previous displayed frame: 0.000000000 seconds]
    [Time since reference or first frame: 0.000000000 seconds]
    Frame Number: 1
    Frame Length: 58 bytes (464 bits)
    Capture Length: 58 bytes (464 bits)
    [Frame is marked: False]
    [Frame is ignored: False]
    [Protocols in frame: ppp:ip:tcp]
Point-to-Point Protocol
    Protocol: Internet Protocol version 4 (0x0021)
Internet Protocol Version 4, Src: 10.1.8.2, Dst: 10.1.8.1
    0100 .... = Version: 4
    .... 0101 = Header Length: 20 bytes (5)
    Differentiated Services Field: 0x00 (DSCP: CS0, ECN: Not-ECT)
        0000 00.. = Differentiated Services Codepoint: Default (0)
        .... ..00 = Explicit Congestion Notification: Not ECN-Capable Transport (0)
    Total Length: 56
    Identification: 0x0000 (0)
    Flags: 0x0000
        0... .... .... .... = Reserved bit: Not set
        .0.. .... .... .... = Don't fragment: Not set
        ..0. .... .... .... = More fragments: Not set
    Fragment offset: 0
    Time to live: 64
    Protocol: TCP (6)
    Header checksum: 0x0000 [validation disabled]
    [Header checksum status: Unverified]
    Source: 10.1.8.2
    Destination: 10.1.8.1
Transmission Control Protocol, Src Port: 49153, Dst Port: 50000, Seq: 0, Len: 0
    Source Port: 49153
    Destination Port: 50000
    [Stream index: 0]
    [TCP Segment Len: 0]
    Sequence number: 0    (relative sequence number)
    Sequence number (raw): 0
    [Next sequence number: 1    (relative sequence number)]
    Acknowledgment number: 0
    Acknowledgment number (raw): 0
    1001 .... = Header Length: 36 bytes (9)
    Flags: 0x002 (SYN)
        000. .... .... = Reserved: Not set
        ...0 .... .... = Nonce: Not set
        .... 0... .... = Congestion Window Reduced (CWR): Not set
        .... .0.. .... = ECN-Echo: Not set
        .... ..0. .... = Urgent: Not set
        .... ...0 .... = Acknowledgment: Not set
        .... .... 0... = Push: Not set
        .... .... .0.. = Reset: Not set
        .... .... ..1. = Syn: Set
            [Expert Info (Chat/Sequence): Connection establish request (SYN): server port 50000]
                [Connection establish request (SYN): server port 50000]
                [Severity level: Chat]
                [Group: Sequence]
        .... .... ...0 = Fin: Not set
        [TCP Flags: ··········S·]
    Window size value: 65535
    [Calculated window size: 65535]
    Checksum: 0x0000 [unverified]
    [Checksum Status: Unverified]
    Urgent pointer: 0
    Options: (16 bytes), Timestamps, Window scale, SACK permitted, End of Option List (EOL)
        TCP Option - Timestamps: TSval 1000, TSecr 0
            Kind: Time Stamp Option (8)
            Length: 10
            Timestamp value: 1000
            Timestamp echo reply: 0
        TCP Option - Window scale: 2 (multiply by 4)
            Kind: Window Scale (3)
            Length: 3
            Shift count: 2
            [Multiplier: 4]
        TCP Option - SACK permitted
            Kind: SACK Permitted (4)
            Length: 2
        TCP Option - End of Option List (EOL)
            Kind: End of Option List (0)
        [Expert Info (Note/Protocol): The SYN packet does not contain a MSS option]
            [The SYN packet does not contain a MSS option]
            [Severity level: Note]
            [Group: Protocol]
    [Timestamps]
        [Time since first frame in this TCP stream: 0.000000000 seconds]
        [Time since previous frame in this TCP stream: 0.000000000 seconds]

Frame 2: 58 bytes on wire (464 bits), 58 bytes captured (464 bits)
    Encapsulation type: PPP (4)
    Arrival Time: Dec 31, 1969 19:00:01.004185000 EST
    [Time shift for this packet: 0.000000000 seconds]
    Epoch Time: 1.004185000 seconds
    [Time delta from previous captured frame: 0.004185000 seconds]
    [Time delta from previous displayed frame: 0.004185000 seconds]
    [Time since reference or first frame: 0.004185000 seconds]
    Frame Number: 2
    Frame Length: 58 bytes (464 bits)
    Capture Length: 58 bytes (464 bits)
    [Frame is marked: False]
    [Frame is ignored: False]
    [Protocols in frame: ppp:ip:tcp]
Point-to-Point Protocol
    Protocol: Internet Protocol version 4 (0x0021)
Internet Protocol Version 4, Src: 10.1.8.1, Dst: 10.1.8.2
    0100 .... = Version: 4
    .... 0101 = Header Length: 20 bytes (5)
    Differentiated Services Field: 0x00 (DSCP: CS0, ECN: Not-ECT)
        0000 00.. = Differentiated Services Codepoint: Default (0)
        .... ..00 = Explicit Congestion Notification: Not ECN-Capable Transport (0)
    Total Length: 56
    Identification: 0x0000 (0)
    Flags: 0x0000
        0... .... .... .... = Reserved bit: Not set
        .0.. .... .... .... = Don't fragment: Not set
        ..0. .... .... .... = More fragments: Not set
    Fragment offset: 0
    Time to live: 64
    Protocol: TCP (6)
    Header checksum: 0x0000 [validation disabled]
    [Header checksum status: Unverified]
    Source: 10.1.8.1
    Destination: 10.1.8.2
Transmission Control Protocol, Src Port: 50000, Dst Port: 49153, Seq: 0, Ack: 1, Len: 0
    Source Port: 50000
    Destination Port: 49153
    [Stream index: 0]
    [TCP Segment Len: 0]
    Sequence number: 0    (relative sequence number)
    Sequence number (raw): 0
    [Next sequence number: 1    (relative sequence number)]
    Acknowledgment number: 1    (relative ack number)
    Acknowledgment number (raw): 1
    1001 .... = Header Length: 36 bytes (9)
    Flags: 0x012 (SYN, ACK)
        000. .... .... = Reserved: Not set
        ...0 .... .... = Nonce: Not set
        .... 0... .... = Congestion Window Reduced (CWR): Not set
        .... .0.. .... = ECN-Echo: Not set
        .... ..0. .... = Urgent: Not set
        .... ...1 .... = Acknowledgment: Set
        .... .... 0... = Push: Not set
        .... .... .0.. = Reset: Not set
        .... .... ..1. = Syn: Set
            [Expert Info (Chat/Sequence): Connection establish acknowledge (SYN+ACK): server port 50000]
                [Connection establish acknowledge (SYN+ACK): server port 50000]
                [Severity level: Chat]
                [Group: Sequence]
        .... .... ...0 = Fin: Not set
        [TCP Flags: ·······A··S·]
    Window size value: 65535
    [Calculated window size: 65535]
    Checksum: 0x0000 [unverified]
    [Checksum Status: Unverified]
    Urgent pointer: 0
    Options: (16 bytes), Timestamps, Window scale, SACK permitted, End of Option List (EOL)
        TCP Option - Timestamps: TSval 1002, TSecr 1000
            Kind: Time Stamp Option (8)
            Length: 10
            Timestamp value: 1002
            Timestamp echo reply: 1000
        TCP Option - Window scale: 2 (multiply by 4)
            Kind: Window Scale (3)
            Length: 3
            Shift count: 2
            [Multiplier: 4]
        TCP Option - SACK permitted
            Kind: SACK Permitted (4)
            Length: 2
        TCP Option - End of Option List (EOL)
            Kind: End of Option List (0)
        [Expert Info (Note/Protocol): The SYN packet does not contain a MSS option]
            [The SYN packet does not contain a MSS option]
            [Severity level: Note]
            [Group: Protocol]
    [SEQ/ACK analysis]
        [This is an ACK to the segment in frame: 1]
        [The RTT to ACK the segment was: 0.004185000 seconds]
    [Timestamps]
        [Time since first frame in this TCP stream: 0.004185000 seconds]
        [Time since previous frame in this TCP stream: 0.004185000 seconds]

Frame 3: 54 bytes on wire (432 bits), 54 bytes captured (432 bits)
    Encapsulation type: PPP (4)
    Arrival Time: Dec 31, 1969 19:00:01.004185000 EST
    [Time shift for this packet: 0.000000000 seconds]
    Epoch Time: 1.004185000 seconds
    [Time delta from previous captured frame: 0.000000000 seconds]
    [Time delta from previous displayed frame: 0.000000000 seconds]
    [Time since reference or first frame: 0.004185000 seconds]
    Frame Number: 3
    Frame Length: 54 bytes (432 bits)
    Capture Length: 54 bytes (432 bits)
    [Frame is marked: False]
    [Frame is ignored: False]
    [Protocols in frame: ppp:ip:tcp]
Point-to-Point Protocol
    Protocol: Internet Protocol version 4 (0x0021)
Internet Protocol Version 4, Src: 10.1.8.2, Dst: 10.1.8.1
    0100 .... = Version: 4
    .... 0101 = Header Length: 20 bytes (5)
    Differentiated Services Field: 0x00 (DSCP: CS0, ECN: Not-ECT)
        0000 00.. = Differentiated Services Codepoint: Default (0)
        .... ..00 = Explicit Congestion Notification: Not ECN-Capable Transport (0)
    Total Length: 52
    Identification: 0x0001 (1)
    Flags: 0x0000
        0... .... .... .... = Reserved bit: Not set
        .0.. .... .... .... = Don't fragment: Not set
        ..0. .... .... .... = More fragments: Not set
    Fragment offset: 0
    Time to live: 64
    Protocol: TCP (6)
    Header checksum: 0x0000 [validation disabled]
    [Header checksum status: Unverified]
    Source: 10.1.8.2
    Destination: 10.1.8.1
Transmission Control Protocol, Src Port: 49153, Dst Port: 50000, Seq: 1, Ack: 1, Len: 0
    Source Port: 49153
    Destination Port: 50000
    [Stream index: 0]
    [TCP Segment Len: 0]
    Sequence number: 1    (relative sequence number)
    Sequence number (raw): 1
    [Next sequence number: 1    (relative sequence number)]
    Acknowledgment number: 1    (relative ack number)
    Acknowledgment number (raw): 1
    1000 .... = Header Length: 32 bytes (8)
    Flags: 0x010 (ACK)
        000. .... .... = Reserved: Not set
        ...0 .... .... = Nonce: Not set
        .... 0... .... = Congestion Window Reduced (CWR): Not set
        .... .0.. .... = ECN-Echo: Not set
        .... ..0. .... = Urgent: Not set
        .... ...1 .... = Acknowledgment: Set
        .... .... 0... = Push: Not set
        .... .... .0.. = Reset: Not set
        .... .... ..0. = Syn: Not set
        .... .... ...0 = Fin: Not set
        [TCP Flags: ·······A····]
    Window size value: 32768
    [Calculated window size: 131072]
    [Window size scaling factor: 4]
    Checksum: 0x0000 [unverified]
    [Checksum Status: Unverified]
    Urgent pointer: 0
    Options: (12 bytes), Timestamps, End of Option List (EOL)
        TCP Option - Timestamps: TSval 1004, TSecr 1002
            Kind: Time Stamp Option (8)
            Length: 10
            Timestamp value: 1004
            Timestamp echo reply: 1002
        TCP Option - End of Option List (EOL)
            Kind: End of Option List (0)
    [SEQ/ACK analysis]
        [This is an ACK to the segment in frame: 2]
        [iRTT: 0.004185000 seconds]
    [Timestamps]
        [Time since first frame in this TCP stream: 0.004185000 seconds]
        [Time since previous frame in this TCP stream: 0.000000000 seconds]

Frame 4: 191 bytes on wire (1528 bits), 191 bytes captured (1528 bits)
    Encapsulation type: PPP (4)
    Arrival Time: Dec 31, 1969 19:00:01.078285000 EST
    [Time shift for this packet: 0.000000000 seconds]
    Epoch Time: 1.078285000 seconds
    [Time delta from previous captured frame: 0.074100000 seconds]
    [Time delta from previous displayed frame: 0.074100000 seconds]
    [Time since reference or first frame: 0.078285000 seconds]
    Frame Number: 4
    Frame Length: 191 bytes (1528 bits)
    Capture Length: 191 bytes (1528 bits)
    [Frame is marked: False]
    [Frame is ignored: False]
    [Protocols in frame: ppp:ip:tcp:data]
Point-to-Point Protocol
    Protocol: Internet Protocol version 4 (0x0021)
Internet Protocol Version 4, Src: 10.1.8.2, Dst: 10.1.8.1
    0100 .... = Version: 4
    .... 0101 = Header Length: 20 bytes (5)
    Differentiated Services Field: 0x00 (DSCP: CS0, ECN: Not-ECT)
        0000 00.. = Differentiated Services Codepoint: Default (0)
        .... ..00 = Explicit Congestion Notification: Not ECN-Capable Transport (0)
    Total Length: 189
    Identification: 0x0002 (2)
    Flags: 0x0000
        0... .... .... .... = Reserved bit: Not set
        .0.. .... .... .... = Don't fragment: Not set
        ..0. .... .... .... = More fragments: Not set
    Fragment offset: 0
    Time to live: 64
    Protocol: TCP (6)
    Header checksum: 0x0000 [validation disabled]
    [Header checksum status: Unverified]
    Source: 10.1.8.2
    Destination: 10.1.8.1
Transmission Control Protocol, Src Port: 49153, Dst Port: 50000, Seq: 1, Ack: 1, Len: 137
    Source Port: 49153
    Destination Port: 50000
    [Stream index: 0]
    [TCP Segment Len: 137]
    Sequence number: 1    (relative sequence number)
    Sequence number (raw): 1
    [Next sequence number: 138    (relative sequence number)]
    Acknowledgment number: 1    (relative ack number)
    Acknowledgment number (raw): 1
    1000 .... = Header Length: 32 bytes (8)
    Flags: 0x010 (ACK)
        000. .... .... = Reserved: Not set
        ...0 .... .... = Nonce: Not set
        .... 0... .... = Congestion Window Reduced (CWR): Not set
        .... .0.. .... = ECN-Echo: Not set
        .... ..0. .... = Urgent: Not set
        .... ...1 .... = Acknowledgment: Set
        .... .... 0... = Push: Not set
        .... .... .0.. = Reset: Not set
        .... .... ..0. = Syn: Not set
        .... .... ...0 = Fin: Not set
        [TCP Flags: ·······A····]
    Window size value: 32768
    [Calculated window size: 131072]
    [Window size scaling factor: 4]
    Checksum: 0x0000 [unverified]
    [Checksum Status: Unverified]
    Urgent pointer: 0
    Options: (12 bytes), Timestamps, End of Option List (EOL)
        TCP Option - Timestamps: TSval 1078, TSecr 1002
            Kind: Time Stamp Option (8)
            Length: 10
            Timestamp value: 1078
            Timestamp echo reply: 1002
        TCP Option - End of Option List (EOL)
            Kind: End of Option List (0)
    [SEQ/ACK analysis]
        [iRTT: 0.004185000 seconds]
        [Bytes in flight: 137]
        [Bytes sent since last PSH flag: 137]
    [Timestamps]
        [Time since first frame in this TCP stream: 0.078285000 seconds]
        [Time since previous frame in this TCP stream: 0.074100000 seconds]
    TCP payload (137 bytes)
Data (137 bytes)

0000  00 00 00 00 00 00 00 00 00 00 00 00 00 00 00 00   ................
0010  00 00 00 00 00 00 00 00 00 00 00 00 00 00 00 00   ................
0020  00 00 00 00 00 00 00 00 00 00 00 00 00 00 00 00   ................
0030  00 00 00 00 00 00 00 00 00 00 00 00 00 00 00 00   ................
0040  00 00 00 00 00 00 00 00 00 00 00 00 00 00 00 00   ................
0050  00 00 00 00 00 00 00 00 00 00 00 00 00 00 00 00   ................
0060  00 00 00 00 00 00 00 00 00 00 00 00 00 00 00 00   ................
0070  00 00 00 00 00 00 00 00 00 00 00 00 00 00 00 00   ................
0080  00 00 00 00 00 00 00 00 00                        .........
    Data: 000000000000000000000000000000000000000000000000…
    [Length: 137]

Frame 5: 54 bytes on wire (432 bits), 54 bytes captured (432 bits)
    Encapsulation type: PPP (4)
    Arrival Time: Dec 31, 1969 19:00:01.082677000 EST
    [Time shift for this packet: 0.000000000 seconds]
    Epoch Time: 1.082677000 seconds
    [Time delta from previous captured frame: 0.004392000 seconds]
    [Time delta from previous displayed frame: 0.004392000 seconds]
    [Time since reference or first frame: 0.082677000 seconds]
    Frame Number: 5
    Frame Length: 54 bytes (432 bits)
    Capture Length: 54 bytes (432 bits)
    [Frame is marked: False]
    [Frame is ignored: False]
    [Protocols in frame: ppp:ip:tcp]
Point-to-Point Protocol
    Protocol: Internet Protocol version 4 (0x0021)
Internet Protocol Version 4, Src: 10.1.8.1, Dst: 10.1.8.2
    0100 .... = Version: 4
    .... 0101 = Header Length: 20 bytes (5)
    Differentiated Services Field: 0x00 (DSCP: CS0, ECN: Not-ECT)
        0000 00.. = Differentiated Services Codepoint: Default (0)
        .... ..00 = Explicit Congestion Notification: Not ECN-Capable Transport (0)
    Total Length: 52
    Identification: 0x0001 (1)
    Flags: 0x0000
        0... .... .... .... = Reserved bit: Not set
        .0.. .... .... .... = Don't fragment: Not set
        ..0. .... .... .... = More fragments: Not set
    Fragment offset: 0
    Time to live: 64
    Protocol: TCP (6)
    Header checksum: 0x0000 [validation disabled]
    [Header checksum status: Unverified]
    Source: 10.1.8.1
    Destination: 10.1.8.2
Transmission Control Protocol, Src Port: 50000, Dst Port: 49153, Seq: 1, Ack: 138, Len: 0
    Source Port: 50000
    Destination Port: 49153
    [Stream index: 0]
    [TCP Segment Len: 0]
    Sequence number: 1    (relative sequence number)
    Sequence number (raw): 1
    [Next sequence number: 1    (relative sequence number)]
    Acknowledgment number: 138    (relative ack number)
    Acknowledgment number (raw): 138
    1000 .... = Header Length: 32 bytes (8)
    Flags: 0x010 (ACK)
        000. .... .... = Reserved: Not set
        ...0 .... .... = Nonce: Not set
        .... 0... .... = Congestion Window Reduced (CWR): Not set
        .... .0.. .... = ECN-Echo: Not set
        .... ..0. .... = Urgent: Not set
        .... ...1 .... = Acknowledgment: Set
        .... .... 0... = Push: Not set
        .... .... .0.. = Reset: Not set
        .... .... ..0. = Syn: Not set
        .... .... ...0 = Fin: Not set
        [TCP Flags: ·······A····]
    Window size value: 32768
    [Calculated window size: 131072]
    [Window size scaling factor: 4]
    Checksum: 0x0000 [unverified]
    [Checksum Status: Unverified]
    Urgent pointer: 0
    Options: (12 bytes), Timestamps, End of Option List (EOL)
        TCP Option - Timestamps: TSval 1080, TSecr 1078
            Kind: Time Stamp Option (8)
            Length: 10
            Timestamp value: 1080
            Timestamp echo reply: 1078
        TCP Option - End of Option List (EOL)
            Kind: End of Option List (0)
    [SEQ/ACK analysis]
        [This is an ACK to the segment in frame: 4]
        [The RTT to ACK the segment was: 0.004392000 seconds]
        [iRTT: 0.004185000 seconds]
    [Timestamps]
        [Time since first frame in this TCP stream: 0.082677000 seconds]
        [Time since previous frame in this TCP stream: 0.004392000 seconds]

Frame 6: 191 bytes on wire (1528 bits), 191 bytes captured (1528 bits)
    Encapsulation type: PPP (4)
    Arrival Time: Dec 31, 1969 19:00:01.156571000 EST
    [Time shift for this packet: 0.000000000 seconds]
    Epoch Time: 1.156571000 seconds
    [Time delta from previous captured frame: 0.073894000 seconds]
    [Time delta from previous displayed frame: 0.073894000 seconds]
    [Time since reference or first frame: 0.156571000 seconds]
    Frame Number: 6
    Frame Length: 191 bytes (1528 bits)
    Capture Length: 191 bytes (1528 bits)
    [Frame is marked: False]
    [Frame is ignored: False]
    [Protocols in frame: ppp:ip:tcp:data]
Point-to-Point Protocol
    Protocol: Internet Protocol version 4 (0x0021)
Internet Protocol Version 4, Src: 10.1.8.2, Dst: 10.1.8.1
    0100 .... = Version: 4
    .... 0101 = Header Length: 20 bytes (5)
    Differentiated Services Field: 0x00 (DSCP: CS0, ECN: Not-ECT)
        0000 00.. = Differentiated Services Codepoint: Default (0)
        .... ..00 = Explicit Congestion Notification: Not ECN-Capable Transport (0)
    Total Length: 189
    Identification: 0x0003 (3)
    Flags: 0x0000
        0... .... .... .... = Reserved bit: Not set
        .0.. .... .... .... = Don't fragment: Not set
        ..0. .... .... .... = More fragments: Not set
    Fragment offset: 0
    Time to live: 64
    Protocol: TCP (6)
    Header checksum: 0x0000 [validation disabled]
    [Header checksum status: Unverified]
    Source: 10.1.8.2
    Destination: 10.1.8.1
Transmission Control Protocol, Src Port: 49153, Dst Port: 50000, Seq: 138, Ack: 1, Len: 137
    Source Port: 49153
    Destination Port: 50000
    [Stream index: 0]
    [TCP Segment Len: 137]
    Sequence number: 138    (relative sequence number)
    Sequence number (raw): 138
    [Next sequence number: 275    (relative sequence number)]
    Acknowledgment number: 1    (relative ack number)
    Acknowledgment number (raw): 1
    1000 .... = Header Length: 32 bytes (8)
    Flags: 0x010 (ACK)
        000. .... .... = Reserved: Not set
        ...0 .... .... = Nonce: Not set
        .... 0... .... = Congestion Window Reduced (CWR): Not set
        .... .0.. .... = ECN-Echo: Not set
        .... ..0. .... = Urgent: Not set
        .... ...1 .... = Acknowledgment: Set
        .... .... 0... = Push: Not set
        .... .... .0.. = Reset: Not set
        .... .... ..0. = Syn: Not set
        .... .... ...0 = Fin: Not set
        [TCP Flags: ·······A····]
    Window size value: 32768
    [Calculated window size: 131072]
    [Window size scaling factor: 4]
    Checksum: 0x0000 [unverified]
    [Checksum Status: Unverified]
    Urgent pointer: 0
    Options: (12 bytes), Timestamps, End of Option List (EOL)
        TCP Option - Timestamps: TSval 1156, TSecr 1080
            Kind: Time Stamp Option (8)
            Length: 10
            Timestamp value: 1156
            Timestamp echo reply: 1080
        TCP Option - End of Option List (EOL)
            Kind: End of Option List (0)
    [SEQ/ACK analysis]
        [iRTT: 0.004185000 seconds]
        [Bytes in flight: 137]
        [Bytes sent since last PSH flag: 274]
    [Timestamps]
        [Time since first frame in this TCP stream: 0.156571000 seconds]
        [Time since previous frame in this TCP stream: 0.073894000 seconds]
    TCP payload (137 bytes)
Data (137 bytes)

0000  00 00 00 00 00 00 00 00 00 00 00 00 00 00 00 00   ................
0010  00 00 00 00 00 00 00 00 00 00 00 00 00 00 00 00   ................
0020  00 00 00 00 00 00 00 00 00 00 00 00 00 00 00 00   ................
0030  00 00 00 00 00 00 00 00 00 00 00 00 00 00 00 00   ................
0040  00 00 00 00 00 00 00 00 00 00 00 00 00 00 00 00   ................
0050  00 00 00 00 00 00 00 00 00 00 00 00 00 00 00 00   ................
0060  00 00 00 00 00 00 00 00 00 00 00 00 00 00 00 00   ................
0070  00 00 00 00 00 00 00 00 00 00 00 00 00 00 00 00   ................
0080  00 00 00 00 00 00 00 00 00                        .........
    Data: 000000000000000000000000000000000000000000000000…
    [Length: 137]

Frame 7: 191 bytes on wire (1528 bits), 191 bytes captured (1528 bits)
    Encapsulation type: PPP (4)
    Arrival Time: Dec 31, 1969 19:00:01.234857000 EST
    [Time shift for this packet: 0.000000000 seconds]
    Epoch Time: 1.234857000 seconds
    [Time delta from previous captured frame: 0.078286000 seconds]
    [Time delta from previous displayed frame: 0.078286000 seconds]
    [Time since reference or first frame: 0.234857000 seconds]
    Frame Number: 7
    Frame Length: 191 bytes (1528 bits)
    Capture Length: 191 bytes (1528 bits)
    [Frame is marked: False]
    [Frame is ignored: False]
    [Protocols in frame: ppp:ip:tcp:data]
Point-to-Point Protocol
    Protocol: Internet Protocol version 4 (0x0021)
Internet Protocol Version 4, Src: 10.1.8.2, Dst: 10.1.8.1
    0100 .... = Version: 4
    .... 0101 = Header Length: 20 bytes (5)
    Differentiated Services Field: 0x00 (DSCP: CS0, ECN: Not-ECT)
        0000 00.. = Differentiated Services Codepoint: Default (0)
        .... ..00 = Explicit Congestion Notification: Not ECN-Capable Transport (0)
    Total Length: 189
    Identification: 0x0004 (4)
    Flags: 0x0000
        0... .... .... .... = Reserved bit: Not set
        .0.. .... .... .... = Don't fragment: Not set
        ..0. .... .... .... = More fragments: Not set
    Fragment offset: 0
    Time to live: 64
    Protocol: TCP (6)
    Header checksum: 0x0000 [validation disabled]
    [Header checksum status: Unverified]
    Source: 10.1.8.2
    Destination: 10.1.8.1
Transmission Control Protocol, Src Port: 49153, Dst Port: 50000, Seq: 275, Ack: 1, Len: 137
    Source Port: 49153
    Destination Port: 50000
    [Stream index: 0]
    [TCP Segment Len: 137]
    Sequence number: 275    (relative sequence number)
    Sequence number (raw): 275
    [Next sequence number: 412    (relative sequence number)]
    Acknowledgment number: 1    (relative ack number)
    Acknowledgment number (raw): 1
    1000 .... = Header Length: 32 bytes (8)
    Flags: 0x010 (ACK)
        000. .... .... = Reserved: Not set
        ...0 .... .... = Nonce: Not set
        .... 0... .... = Congestion Window Reduced (CWR): Not set
        .... .0.. .... = ECN-Echo: Not set
        .... ..0. .... = Urgent: Not set
        .... ...1 .... = Acknowledgment: Set
        .... .... 0... = Push: Not set
        .... .... .0.. = Reset: Not set
        .... .... ..0. = Syn: Not set
        .... .... ...0 = Fin: Not set
        [TCP Flags: ·······A····]
    Window size value: 32768
    [Calculated window size: 131072]
    [Window size scaling factor: 4]
    Checksum: 0x0000 [unverified]
    [Checksum Status: Unverified]
    Urgent pointer: 0
    Options: (12 bytes), Timestamps, End of Option List (EOL)
        TCP Option - Timestamps: TSval 1234, TSecr 1080
            Kind: Time Stamp Option (8)
            Length: 10
            Timestamp value: 1234
            Timestamp echo reply: 1080
        TCP Option - End of Option List (EOL)
            Kind: End of Option List (0)
    [SEQ/ACK analysis]
        [iRTT: 0.004185000 seconds]
        [Bytes in flight: 274]
        [Bytes sent since last PSH flag: 411]
    [Timestamps]
        [Time since first frame in this TCP stream: 0.234857000 seconds]
        [Time since previous frame in this TCP stream: 0.078286000 seconds]
    TCP payload (137 bytes)
Data (137 bytes)

0000  00 00 00 00 00 00 00 00 00 00 00 00 00 00 00 00   ................
0010  00 00 00 00 00 00 00 00 00 00 00 00 00 00 00 00   ................
0020  00 00 00 00 00 00 00 00 00 00 00 00 00 00 00 00   ................
0030  00 00 00 00 00 00 00 00 00 00 00 00 00 00 00 00   ................
0040  00 00 00 00 00 00 00 00 00 00 00 00 00 00 00 00   ................
0050  00 00 00 00 00 00 00 00 00 00 00 00 00 00 00 00   ................
0060  00 00 00 00 00 00 00 00 00 00 00 00 00 00 00 00   ................
0070  00 00 00 00 00 00 00 00 00 00 00 00 00 00 00 00   ................
0080  00 00 00 00 00 00 00 00 00                        .........
    Data: 000000000000000000000000000000000000000000000000…
    [Length: 137]

Frame 8: 54 bytes on wire (432 bits), 54 bytes captured (432 bits)
    Encapsulation type: PPP (4)
    Arrival Time: Dec 31, 1969 19:00:01.239249000 EST
    [Time shift for this packet: 0.000000000 seconds]
    Epoch Time: 1.239249000 seconds
    [Time delta from previous captured frame: 0.004392000 seconds]
    [Time delta from previous displayed frame: 0.004392000 seconds]
    [Time since reference or first frame: 0.239249000 seconds]
    Frame Number: 8
    Frame Length: 54 bytes (432 bits)
    Capture Length: 54 bytes (432 bits)
    [Frame is marked: False]
    [Frame is ignored: False]
    [Protocols in frame: ppp:ip:tcp]
Point-to-Point Protocol
    Protocol: Internet Protocol version 4 (0x0021)
Internet Protocol Version 4, Src: 10.1.8.1, Dst: 10.1.8.2
    0100 .... = Version: 4
    .... 0101 = Header Length: 20 bytes (5)
    Differentiated Services Field: 0x00 (DSCP: CS0, ECN: Not-ECT)
        0000 00.. = Differentiated Services Codepoint: Default (0)
        .... ..00 = Explicit Congestion Notification: Not ECN-Capable Transport (0)
    Total Length: 52
    Identification: 0x0002 (2)
    Flags: 0x0000
        0... .... .... .... = Reserved bit: Not set
        .0.. .... .... .... = Don't fragment: Not set
        ..0. .... .... .... = More fragments: Not set
    Fragment offset: 0
    Time to live: 64
    Protocol: TCP (6)
    Header checksum: 0x0000 [validation disabled]
    [Header checksum status: Unverified]
    Source: 10.1.8.1
    Destination: 10.1.8.2
Transmission Control Protocol, Src Port: 50000, Dst Port: 49153, Seq: 1, Ack: 412, Len: 0
    Source Port: 50000
    Destination Port: 49153
    [Stream index: 0]
    [TCP Segment Len: 0]
    Sequence number: 1    (relative sequence number)
    Sequence number (raw): 1
    [Next sequence number: 1    (relative sequence number)]
    Acknowledgment number: 412    (relative ack number)
    Acknowledgment number (raw): 412
    1000 .... = Header Length: 32 bytes (8)
    Flags: 0x010 (ACK)
        000. .... .... = Reserved: Not set
        ...0 .... .... = Nonce: Not set
        .... 0... .... = Congestion Window Reduced (CWR): Not set
        .... .0.. .... = ECN-Echo: Not set
        .... ..0. .... = Urgent: Not set
        .... ...1 .... = Acknowledgment: Set
        .... .... 0... = Push: Not set
        .... .... .0.. = Reset: Not set
        .... .... ..0. = Syn: Not set
        .... .... ...0 = Fin: Not set
        [TCP Flags: ·······A····]
    Window size value: 32768
    [Calculated window size: 131072]
    [Window size scaling factor: 4]
    Checksum: 0x0000 [unverified]
    [Checksum Status: Unverified]
    Urgent pointer: 0
    Options: (12 bytes), Timestamps, End of Option List (EOL)
        TCP Option - Timestamps: TSval 1237, TSecr 1156
            Kind: Time Stamp Option (8)
            Length: 10
            Timestamp value: 1237
            Timestamp echo reply: 1156
        TCP Option - End of Option List (EOL)
            Kind: End of Option List (0)
    [SEQ/ACK analysis]
        [This is an ACK to the segment in frame: 7]
        [The RTT to ACK the segment was: 0.004392000 seconds]
        [iRTT: 0.004185000 seconds]
    [Timestamps]
        [Time since first frame in this TCP stream: 0.239249000 seconds]
        [Time since previous frame in this TCP stream: 0.004392000 seconds]

Frame 9: 191 bytes on wire (1528 bits), 191 bytes captured (1528 bits)
    Encapsulation type: PPP (4)
    Arrival Time: Dec 31, 1969 19:00:01.313142000 EST
    [Time shift for this packet: 0.000000000 seconds]
    Epoch Time: 1.313142000 seconds
    [Time delta from previous captured frame: 0.073893000 seconds]
    [Time delta from previous displayed frame: 0.073893000 seconds]
    [Time since reference or first frame: 0.313142000 seconds]
    Frame Number: 9
    Frame Length: 191 bytes (1528 bits)
    Capture Length: 191 bytes (1528 bits)
    [Frame is marked: False]
    [Frame is ignored: False]
    [Protocols in frame: ppp:ip:tcp:data]
Point-to-Point Protocol
    Protocol: Internet Protocol version 4 (0x0021)
Internet Protocol Version 4, Src: 10.1.8.2, Dst: 10.1.8.1
    0100 .... = Version: 4
    .... 0101 = Header Length: 20 bytes (5)
    Differentiated Services Field: 0x00 (DSCP: CS0, ECN: Not-ECT)
        0000 00.. = Differentiated Services Codepoint: Default (0)
        .... ..00 = Explicit Congestion Notification: Not ECN-Capable Transport (0)
    Total Length: 189
    Identification: 0x0005 (5)
    Flags: 0x0000
        0... .... .... .... = Reserved bit: Not set
        .0.. .... .... .... = Don't fragment: Not set
        ..0. .... .... .... = More fragments: Not set
    Fragment offset: 0
    Time to live: 64
    Protocol: TCP (6)
    Header checksum: 0x0000 [validation disabled]
    [Header checksum status: Unverified]
    Source: 10.1.8.2
    Destination: 10.1.8.1
Transmission Control Protocol, Src Port: 49153, Dst Port: 50000, Seq: 412, Ack: 1, Len: 137
    Source Port: 49153
    Destination Port: 50000
    [Stream index: 0]
    [TCP Segment Len: 137]
    Sequence number: 412    (relative sequence number)
    Sequence number (raw): 412
    [Next sequence number: 549    (relative sequence number)]
    Acknowledgment number: 1    (relative ack number)
    Acknowledgment number (raw): 1
    1000 .... = Header Length: 32 bytes (8)
    Flags: 0x010 (ACK)
        000. .... .... = Reserved: Not set
        ...0 .... .... = Nonce: Not set
        .... 0... .... = Congestion Window Reduced (CWR): Not set
        .... .0.. .... = ECN-Echo: Not set
        .... ..0. .... = Urgent: Not set
        .... ...1 .... = Acknowledgment: Set
        .... .... 0... = Push: Not set
        .... .... .0.. = Reset: Not set
        .... .... ..0. = Syn: Not set
        .... .... ...0 = Fin: Not set
        [TCP Flags: ·······A····]
    Window size value: 32768
    [Calculated window size: 131072]
    [Window size scaling factor: 4]
    Checksum: 0x0000 [unverified]
    [Checksum Status: Unverified]
    Urgent pointer: 0
    Options: (12 bytes), Timestamps, End of Option List (EOL)
        TCP Option - Timestamps: TSval 1313, TSecr 1237
            Kind: Time Stamp Option (8)
            Length: 10
            Timestamp value: 1313
            Timestamp echo reply: 1237
        TCP Option - End of Option List (EOL)
            Kind: End of Option List (0)
    [SEQ/ACK analysis]
        [iRTT: 0.004185000 seconds]
        [Bytes in flight: 137]
        [Bytes sent since last PSH flag: 548]
    [Timestamps]
        [Time since first frame in this TCP stream: 0.313142000 seconds]
        [Time since previous frame in this TCP stream: 0.073893000 seconds]
    TCP payload (137 bytes)
Data (137 bytes)

0000  00 00 00 00 00 00 00 00 00 00 00 00 00 00 00 00   ................
0010  00 00 00 00 00 00 00 00 00 00 00 00 00 00 00 00   ................
0020  00 00 00 00 00 00 00 00 00 00 00 00 00 00 00 00   ................
0030  00 00 00 00 00 00 00 00 00 00 00 00 00 00 00 00   ................
0040  00 00 00 00 00 00 00 00 00 00 00 00 00 00 00 00   ................
0050  00 00 00 00 00 00 00 00 00 00 00 00 00 00 00 00   ................
0060  00 00 00 00 00 00 00 00 00 00 00 00 00 00 00 00   ................
0070  00 00 00 00 00 00 00 00 00 00 00 00 00 00 00 00   ................
0080  00 00 00 00 00 00 00 00 00                        .........
    Data: 000000000000000000000000000000000000000000000000…
    [Length: 137]

Frame 10: 191 bytes on wire (1528 bits), 191 bytes captured (1528 bits)
    Encapsulation type: PPP (4)
    Arrival Time: Dec 31, 1969 19:00:01.391428000 EST
    [Time shift for this packet: 0.000000000 seconds]
    Epoch Time: 1.391428000 seconds
    [Time delta from previous captured frame: 0.078286000 seconds]
    [Time delta from previous displayed frame: 0.078286000 seconds]
    [Time since reference or first frame: 0.391428000 seconds]
    Frame Number: 10
    Frame Length: 191 bytes (1528 bits)
    Capture Length: 191 bytes (1528 bits)
    [Frame is marked: False]
    [Frame is ignored: False]
    [Protocols in frame: ppp:ip:tcp:data]
Point-to-Point Protocol
    Protocol: Internet Protocol version 4 (0x0021)
Internet Protocol Version 4, Src: 10.1.8.2, Dst: 10.1.8.1
    0100 .... = Version: 4
    .... 0101 = Header Length: 20 bytes (5)
    Differentiated Services Field: 0x00 (DSCP: CS0, ECN: Not-ECT)
        0000 00.. = Differentiated Services Codepoint: Default (0)
        .... ..00 = Explicit Congestion Notification: Not ECN-Capable Transport (0)
    Total Length: 189
    Identification: 0x0006 (6)
    Flags: 0x0000
        0... .... .... .... = Reserved bit: Not set
        .0.. .... .... .... = Don't fragment: Not set
        ..0. .... .... .... = More fragments: Not set
    Fragment offset: 0
    Time to live: 64
    Protocol: TCP (6)
    Header checksum: 0x0000 [validation disabled]
    [Header checksum status: Unverified]
    Source: 10.1.8.2
    Destination: 10.1.8.1
Transmission Control Protocol, Src Port: 49153, Dst Port: 50000, Seq: 549, Ack: 1, Len: 137
    Source Port: 49153
    Destination Port: 50000
    [Stream index: 0]
    [TCP Segment Len: 137]
    Sequence number: 549    (relative sequence number)
    Sequence number (raw): 549
    [Next sequence number: 686    (relative sequence number)]
    Acknowledgment number: 1    (relative ack number)
    Acknowledgment number (raw): 1
    1000 .... = Header Length: 32 bytes (8)
    Flags: 0x010 (ACK)
        000. .... .... = Reserved: Not set
        ...0 .... .... = Nonce: Not set
        .... 0... .... = Congestion Window Reduced (CWR): Not set
        .... .0.. .... = ECN-Echo: Not set
        .... ..0. .... = Urgent: Not set
        .... ...1 .... = Acknowledgment: Set
        .... .... 0... = Push: Not set
        .... .... .0.. = Reset: Not set
        .... .... ..0. = Syn: Not set
        .... .... ...0 = Fin: Not set
        [TCP Flags: ·······A····]
    Window size value: 32768
    [Calculated window size: 131072]
    [Window size scaling factor: 4]
    Checksum: 0x0000 [unverified]
    [Checksum Status: Unverified]
    Urgent pointer: 0
    Options: (12 bytes), Timestamps, End of Option List (EOL)
        TCP Option - Timestamps: TSval 1391, TSecr 1237
            Kind: Time Stamp Option (8)
            Length: 10
            Timestamp value: 1391
            Timestamp echo reply: 1237
        TCP Option - End of Option List (EOL)
            Kind: End of Option List (0)
    [SEQ/ACK analysis]
        [iRTT: 0.004185000 seconds]
        [Bytes in flight: 274]
        [Bytes sent since last PSH flag: 685]
    [Timestamps]
        [Time since first frame in this TCP stream: 0.391428000 seconds]
        [Time since previous frame in this TCP stream: 0.078286000 seconds]
    TCP payload (137 bytes)
Data (137 bytes)

0000  00 00 00 00 00 00 00 00 00 00 00 00 00 00 00 00   ................
0010  00 00 00 00 00 00 00 00 00 00 00 00 00 00 00 00   ................
0020  00 00 00 00 00 00 00 00 00 00 00 00 00 00 00 00   ................
0030  00 00 00 00 00 00 00 00 00 00 00 00 00 00 00 00   ................
0040  00 00 00 00 00 00 00 00 00 00 00 00 00 00 00 00   ................
0050  00 00 00 00 00 00 00 00 00 00 00 00 00 00 00 00   ................
0060  00 00 00 00 00 00 00 00 00 00 00 00 00 00 00 00   ................
0070  00 00 00 00 00 00 00 00 00 00 00 00 00 00 00 00   ................
0080  00 00 00 00 00 00 00 00 00                        .........
    Data: 000000000000000000000000000000000000000000000000…
    [Length: 137]

Frame 11: 54 bytes on wire (432 bits), 54 bytes captured (432 bits)
    Encapsulation type: PPP (4)
    Arrival Time: Dec 31, 1969 19:00:01.395820000 EST
    [Time shift for this packet: 0.000000000 seconds]
    Epoch Time: 1.395820000 seconds
    [Time delta from previous captured frame: 0.004392000 seconds]
    [Time delta from previous displayed frame: 0.004392000 seconds]
    [Time since reference or first frame: 0.395820000 seconds]
    Frame Number: 11
    Frame Length: 54 bytes (432 bits)
    Capture Length: 54 bytes (432 bits)
    [Frame is marked: False]
    [Frame is ignored: False]
    [Protocols in frame: ppp:ip:tcp]
Point-to-Point Protocol
    Protocol: Internet Protocol version 4 (0x0021)
Internet Protocol Version 4, Src: 10.1.8.1, Dst: 10.1.8.2
    0100 .... = Version: 4
    .... 0101 = Header Length: 20 bytes (5)
    Differentiated Services Field: 0x00 (DSCP: CS0, ECN: Not-ECT)
        0000 00.. = Differentiated Services Codepoint: Default (0)
        .... ..00 = Explicit Congestion Notification: Not ECN-Capable Transport (0)
    Total Length: 52
    Identification: 0x0003 (3)
    Flags: 0x0000
        0... .... .... .... = Reserved bit: Not set
        .0.. .... .... .... = Don't fragment: Not set
        ..0. .... .... .... = More fragments: Not set
    Fragment offset: 0
    Time to live: 64
    Protocol: TCP (6)
    Header checksum: 0x0000 [validation disabled]
    [Header checksum status: Unverified]
    Source: 10.1.8.1
    Destination: 10.1.8.2
Transmission Control Protocol, Src Port: 50000, Dst Port: 49153, Seq: 1, Ack: 686, Len: 0
    Source Port: 50000
    Destination Port: 49153
    [Stream index: 0]
    [TCP Segment Len: 0]
    Sequence number: 1    (relative sequence number)
    Sequence number (raw): 1
    [Next sequence number: 1    (relative sequence number)]
    Acknowledgment number: 686    (relative ack number)
    Acknowledgment number (raw): 686
